2118737, SEM1, 2020/2021, 4.00, 4.00, 120.00, 30, CS4012, A1, CS4141, A1, CS4221, A1, ET4011, A1, MA4111, A1
2392871, SEM1, 2020/2021, 1.92, 1.92, 57.60, 30, CS4012, F, CS4141, C2, CS4221, C2, ET4011, C2, MA4111, C2
2918382, SEM1, 2020/2021, 0.00, 0.00, 0.00, 30, CS4012, F, CS4141, F, CS4221, F, ET4011, F, MA4111, F
2118737, SEM2, 2020/2021, 4.00, 4.00, 120.00, 30, CS4043, A1, CS4182, A1, CS4222, A1, ET4162, A1, MA4402, A1
2392871, SEM2, 2020/2021, 1.92, 1.92, 57.60, 30, CS4043, F, CS4182, C2, CS4222, C2, ET4162, C2, MA4402, C2
2918382, SEM2, 2020/2021, 0.00, 0.00, 0.00, 30, CS4043, F, CS4182, F, CS4222, F, ET4162, F, MA4402, F
2118737, SEM1, 2021/2022, 3.20, 3.73, 96.00, 30, CS4004, B1, CS4013, B1, CS4023, B1, CS4178, B1, CS4416, B1
2118737, SEM1, 2020/2021, 4.00, 3.75, 24.00, 6, CS4012, A1
2392871, SEM1, 2020/2021, 0.00, 1.75, 0.00, 6, CS4012, F
2918382, SEM1, 2020/2021, 0.00, 0.00, 0.00, 6, CS4012, F
